{
  "version": "steer-domain-review-record/v1",
  "domain": "accessibility",
  "reviewType": "gate-2-exam",
  "target": {
    "organization": "steer-platform",
    "item": "0001-flight-deck-foundation",
    "revision": "9c7299dd658615cd234e8e03188d607ef1a99fe1",
    "exam": {
      "path": "intent/0001/EXAM.md",
      "sha256": "91f2744d0675f3c62eb122b2783e3aee147c85981740d0f3f4409b53808e6b10"
    }
  },
  "reviewer": {
    "serviceIdentity": "codex:/root/accessibility_domain_r2",
    "agentType": "independent-fresh-context-accessibility-domain-review-agent",
    "model": "exact serving model identifier not exposed to this task",
    "configurationRevision": "task-assignment:/root/accessibility_domain_r2@2026-09-03;round-2-target-sha256:ff75216bfd77b8528c52068f17988f292f30dbd2604c63408596f8e1c30a922a;packet-sha256:f2a4318b6ba7adc489b0a014f95c3740449d0eec996c994b1c092270332087b9",
    "freshContext": true,
    "freshContextEvidence": "Fresh delegated task /root/accessibility_domain_r2 was created solely to review accessibility Gate 2 Exam adequacy at revision 9c7299dd658615cd234e8e03188d607ef1a99fe1. It inspected the complete canonical Exam and bound evidence independently and did not act as, inherit, or coordinate with the Builder role.",
    "builderIndependent": true
  },
  "decision": "send-back",
  "confidence": "high",
  "reviewedAt": "2026-09-03T21:34:40Z",
  "reviewedCases": [
    "OR-21",
    "OR-22"
  ],
  "evidence": [
    {
      "path": "intent/0001/EXAM.md",
      "sha256": "91f2744d0675f3c62eb122b2783e3aee147c85981740d0f3f4409b53808e6b10"
    },
    {
      "path": "intent/0001/BRIEF.md",
      "sha256": "a5af593397de0722666baefae846b31881c6429c9691bec886f4a0771a8bc97f"
    },
    {
      "path": "intent/0001/SPEC.md",
      "sha256": "7330397f7a406b1d88d4f6a2c7205e8671d75c07bfec7840775c2b2614af54ff"
    },
    {
      "path": "intent/0001/reviews/domain/accessibility.md",
      "sha256": "f2a4318b6ba7adc489b0a014f95c3740449d0eec996c994b1c092270332087b9"
    },
    {
      "path": "intent/0001/reviews/domain/records/accessibility.json",
      "sha256": "3f87546984cb58ba7a1e14a7dd5dcd44d09d792241e7cb0f0bc2e310c1806785"
    },
    {
      "path": "intent/0001/reviews/domain/exception-brief.json",
      "sha256": "95092dd8f3fc56b4d2cff306227f8ab4bc1fa9484cda50a3b79131abac86c805"
    },
    {
      "path": "intent/0001/reviews/domain/remediation/ACCESSIBILITY-81-CHECKPOINTS.md",
      "sha256": "43d61f4bd52afbb0f206fece2b4f2d784d4af9a4d57fe9f25d2c22a6cab5e361"
    },
    {
      "path": "intent/0001/reviews/domain/remediation/remediation-manifest.json",
      "sha256": "d03fbf07bf9bb3b2616682a278ef9fdce5c0ad278f4aefec3b034cc1cd252369"
    },
    {
      "path": "intent/0001/reviews/domain/remediation/preflight-critic-r6.json",
      "sha256": "a1a519d5c237603c775736a50403d143726e4a22e65e8da847d85799b4ea3830"
    },
    {
      "path": "intent/0001/reviews/domain/remediation/human-rulings/hr-01.json",
      "sha256": "ab24437ac426e1da759d6163afab0e1467bc9e19809a57e83566cc89cbd73074"
    },
    {
      "path": "kit/schemas/domain-review-record.schema.json",
      "sha256": "50cc75af34849a08dd2ef966a2bf944b711c861b5bd955d1cb9e33c0820857ea"
    },
    {
      "path": "intent/0001/reviews/domain/round-2/README.md",
      "sha256": "b064d28971ec422a5c446762950a6e0f917abb036d159dd65e2ed58e501cad26"
    },
    {
      "path": "intent/0001/reviews/domain/round-2/review-target.json",
      "sha256": "ff75216bfd77b8528c52068f17988f292f30dbd2604c63408596f8e1c30a922a"
    }
  ],
  "findings": [
    {
      "id": "ACC-G2-001",
      "severity": "blocker",
      "status": "resolved",
      "summary": "Resolved. Replacement OR-21 and OR-22 plus A9.2 require a complete ledger for every applicable WCAG 2.1 A/AA success criterion and Revised Section 508 software/web requirement, distinguish automated, manual, and combined evaluation, and fail on any unresolved conformance failure regardless of axe impact or severity.",
      "evidence": [
        {
          "path": "intent/0001/EXAM.md",
          "sha256": "91f2744d0675f3c62eb122b2783e3aee147c85981740d0f3f4409b53808e6b10"
        },
        {
          "path": "intent/0001/reviews/domain/records/accessibility.json",
          "sha256": "3f87546984cb58ba7a1e14a7dd5dcd44d09d792241e7cb0f0bc2e310c1806785"
        }
      ],
      "requiredResolution": "Satisfied by EXAM.md A4.2 OR-21/OR-22 and A9.2 at the reviewed revision; preserve those clauses and exact-revision evidence binding."
    },
    {
      "id": "ACC-G2-002",
      "severity": "blocker",
      "status": "resolved",
      "summary": "Resolved. A9.1 enumerates eight production routes, applicable route and interaction states, shared Storybook surfaces and states, four numeric viewports, zoom/text-spacing/reduced-motion/forced-color/theme/orientation conditions, and a bidirectional completeness comparison with the built route registry and Storybook index.",
      "evidence": [
        {
          "path": "intent/0001/EXAM.md",
          "sha256": "91f2744d0675f3c62eb122b2783e3aee147c85981740d0f3f4409b53808e6b10"
        },
        {
          "path": "intent/0001/reviews/domain/records/accessibility.json",
          "sha256": "3f87546984cb58ba7a1e14a7dd5dcd44d09d792241e7cb0f0bc2e310c1806785"
        }
      ],
      "requiredResolution": "Satisfied by EXAM.md A9.1 and the zero-omission predicates in A4.2 OR-21 at the reviewed revision; preserve the complete inventory and bidirectional registry checks."
    },
    {
      "id": "ACC-G2-003",
      "severity": "major",
      "status": "resolved",
      "summary": "Resolved. A1 digest-binds the versioned 81-checkpoint model; A9.2 freezes five screen-reader/browser/OS environment families and the complete scenario set; OR-22 and the checkpoint model require raw checkpoint-level results, exact environment versions, operator identity, evidence references, and exact Exam and implementation revisions in addition to a separately signed summary.",
      "evidence": [
        {
          "path": "intent/0001/EXAM.md",
          "sha256": "91f2744d0675f3c62eb122b2783e3aee147c85981740d0f3f4409b53808e6b10"
        },
        {
          "path": "intent/0001/reviews/domain/remediation/ACCESSIBILITY-81-CHECKPOINTS.md",
          "sha256": "43d61f4bd52afbb0f206fece2b4f2d784d4af9a4d57fe9f25d2c22a6cab5e361"
        },
        {
          "path": "intent/0001/reviews/domain/records/accessibility.json",
          "sha256": "3f87546984cb58ba7a1e14a7dd5dcd44d09d792241e7cb0f0bc2e310c1806785"
        }
      ],
      "requiredResolution": "Satisfied by EXAM.md A1, A4.2 OR-22, and A9.2 together with the digest-bound ACCESSIBILITY-81-CHECKPOINTS.md model; preserve the complete scenario/environment matrix and raw-result contract."
    },
    {
      "id": "ACC-G2-R2-001",
      "severity": "major",
      "status": "open",
      "summary": "The accepted Spec requires the platform pod's own DHS Trusted Tester review at Gate 3 for new UI, but replacement OR-22 only requires a generic qualified human specialist, A9.2 defines environments and scenarios without naming the DHS Trusted Tester requirement, and the 81-checkpoint raw record requires operator identity but not qualification or platform-pod role evidence. The technical-release verdict can therefore accept manual evidence from a reviewer who does not meet the signed Gate 1 reviewer requirement.",
      "evidence": [
        {
          "path": "intent/0001/SPEC.md",
          "sha256": "7330397f7a406b1d88d4f6a2c7205e8671d75c07bfec7840775c2b2614af54ff"
        },
        {
          "path": "intent/0001/EXAM.md",
          "sha256": "91f2744d0675f3c62eb122b2783e3aee147c85981740d0f3f4409b53808e6b10"
        },
        {
          "path": "intent/0001/reviews/domain/remediation/ACCESSIBILITY-81-CHECKPOINTS.md",
          "sha256": "43d61f4bd52afbb0f206fece2b4f2d784d4af9a4d57fe9f25d2c22a6cab5e361"
        }
      ],
      "requiredResolution": "Amend OR-22/A9 and the raw/signed evidence contract to require the platform pod's DHS Trusted Tester review at Gate 3 for new UI exactly as accepted in the Spec, and require durable evidence of the human reviewer's applicable DHS Trusted Tester qualification and platform-pod role or assignment, bound to the exact Exam and implementation revisions. This defines future release evidence; it does not require performing the human review at Gate 2."
    }
  ],
  "escalations": [
    {
      "triggerId": "unresolved-blocker-or-major-finding",
      "reason": "ACC-G2-R2-001 is an unresolved major Exam-adequacy finding: the future manual release record does not enforce the signed Spec's named DHS Trusted Tester reviewer requirement.",
      "findingIds": [
        "ACC-G2-R2-001"
      ]
    },
    {
      "triggerId": "law-regulation-contract-or-policy-requires-human-specialist",
      "reason": "The accepted Spec invokes the platform pod's DHS Trusted Tester review for the Section 508/WCAG 2.1 AA release obligation. The Exam must preserve that qualification requirement, and the later human reviewer must supply the required judgment and evidence.",
      "findingIds": [
        "ACC-G2-R2-001"
      ]
    },
    {
      "triggerId": "user-facing-accessibility-manual-release-validation",
      "reason": "This user-facing item still requires the complete human keyboard and assistive-technology validation at technical release/Gate 3. This Gate 2 review evaluates whether the Exam defines that future evidence and does not claim that any implementation or manual accessibility validation has passed.",
      "findingIds": []
    }
  ],
  "boundaries": {
    "doesNotSignGateTwo": true,
    "doesNotAuthorizeBuildOrRelease": true,
    "doesNotAuthorizeProductionOrSpend": true,
    "doesNotAcceptResidualRiskOrWaiveControls": true
  }
}
