{
  "version": "steer-domain-review-record/v1",
  "domain": "irreversible-operations",
  "reviewType": "gate-2-exam",
  "target": {
    "organization": "steer-platform",
    "item": "0001-flight-deck-foundation",
    "revision": "9c7299dd658615cd234e8e03188d607ef1a99fe1",
    "exam": {
      "path": "intent/0001/EXAM.md",
      "sha256": "91f2744d0675f3c62eb122b2783e3aee147c85981740d0f3f4409b53808e6b10"
    }
  },
  "reviewer": {
    "serviceIdentity": "codex-task:/root/irrev_record_only",
    "agentType": "independent-fresh-context-irreversible-operations-review-agent",
    "model": "exact serving model identifier not exposed to this task",
    "configurationRevision": "task-assignment:/root/irrev_record_only@2026-09-03;target:9c7299dd658615cd234e8e03188d607ef1a99fe1",
    "freshContext": true,
    "freshContextEvidence": "Fresh task /root/irrev_record_only was assigned only to produce the independent irreversible-operations round-two record for revision 9c7299dd658615cd234e8e03188d607ef1a99fe1, performed no Builder work, and bound its disposition to the supplied target and evidence manifest.",
    "builderIndependent": true
  },
  "decision": "send-back",
  "confidence": "high",
  "reviewedAt": "2026-09-03T22:10:32Z",
  "reviewedCases": [
    "A7.1 exhaustive effective-permissions manifest and fail-on-extra oracle",
    "A8 retention, hold, export, deletion, tombstone, and disposition lifecycle",
    "A10.3 forward-only migration and destructive contract execution",
    "Permissions coverage for lifecycle deletion and disposition",
    "Permissions coverage for schema-migration execution",
    "Prior finding reassessment: IRREV-G2-001 substantively resolved",
    "Prior finding reassessment: IRREV-G2-002 substantively resolved",
    "Prior finding reassessment: IRREV-G2-003 substantively resolved",
    "Prior finding reassessment: IRREV-G2-004 substantively resolved"
  ],
  "evidence": [
    {
      "path": "intent/0001/EXAM.md",
      "sha256": "91f2744d0675f3c62eb122b2783e3aee147c85981740d0f3f4409b53808e6b10"
    },
    {
      "path": "intent/0001/BRIEF.md",
      "sha256": "a5af593397de0722666baefae846b31881c6429c9691bec886f4a0771a8bc97f"
    },
    {
      "path": "intent/0001/SPEC.md",
      "sha256": "7330397f7a406b1d88d4f6a2c7205e8671d75c07bfec7840775c2b2614af54ff"
    },
    {
      "path": "intent/0001/ARCHITECTURE.md",
      "sha256": "9e1783a5f9870e8a8a2595d23226efa804902b4c472e309bf9f924d8cf61dc65"
    },
    {
      "path": "intent/0001/PLAN.md",
      "sha256": "92696a531e61d988a593b31e81a76cb1aae19348c23d665ed301490ac2544b5f"
    },
    {
      "path": "intent/0001/signatures/gate-1.json",
      "sha256": "63032a9b2ff0f3a41af0b38b887b648e604336156a5bcefbe32de18648556709"
    },
    {
      "path": "kit/policy/gates.json",
      "sha256": "68f53ae5845445758eb7cb8a1a8518f31c37120cfe92373b6bf0f8dfed404b56"
    },
    {
      "path": "intent/0001/evidence/github-exam-protection-rollout.json",
      "sha256": "b61c40a640ae0348aeadd191091c14225003d1e733c618e841e4da5804513e0d"
    },
    {
      "path": "intent/0001/reviews/domain/exception-brief.json",
      "sha256": "95092dd8f3fc56b4d2cff306227f8ab4bc1fa9484cda50a3b79131abac86c805"
    },
    {
      "path": "intent/0001/reviews/domain/remediation/remediation-manifest.json",
      "sha256": "d03fbf07bf9bb3b2616682a278ef9fdce5c0ad278f4aefec3b034cc1cd252369"
    },
    {
      "path": "intent/0001/reviews/domain/remediation/preflight-critic-r6.json",
      "sha256": "a1a519d5c237603c775736a50403d143726e4a22e65e8da847d85799b4ea3830"
    },
    {
      "path": "intent/0001/reviews/domain/remediation/human-rulings/hr-01.json",
      "sha256": "ab24437ac426e1da759d6163afab0e1467bc9e19809a57e83566cc89cbd73074"
    },
    {
      "path": "intent/0001/reviews/domain/remediation/ACCESSIBILITY-81-CHECKPOINTS.md",
      "sha256": "43d61f4bd52afbb0f206fece2b4f2d784d4af9a4d57fe9f25d2c22a6cab5e361"
    },
    {
      "path": "intent/0001/reviews/domain/remediation/PERMISSIONS-MANIFEST.candidate.json",
      "sha256": "46a483533cb1153b0391a9463ca6c3848862ed3bf43b9c7e861077860175bf73"
    },
    {
      "path": "intent/0001/reviews/domain/remediation/RETENTION-AND-RECORDS-POLICY.candidate.md",
      "sha256": "271d4fa1ee2682f06e504e615cc9e8588ea34ff3ff7d5e2c27f245f80509c96c"
    },
    {
      "path": "intent/0001/reviews/domain/remediation/SIGNED-LOG-SPEC.candidate.md",
      "sha256": "ece4df65505ed563137d6e4797cbe8977a6ef3cfd3be05dd6ef62da9a15ecbbe"
    },
    {
      "path": "intent/0001/reviews/domain/remediation/SIGNED-LOG-VECTORS.candidate.json",
      "sha256": "1a03cdc28b353036ff612f1d8c93bd3f832e3b1adbc7f77a29a13dbc47a7a168"
    },
    {
      "path": "intent/0001/reviews/domain/remediation/validate-remediation.mjs",
      "sha256": "15197f339d9eed125885c806f66adff790d67e69247910236b84f9107a0d1044"
    }
  ],
  "findings": [
    {
      "id": "IRREV-G2-R2-001",
      "severity": "major",
      "status": "open",
      "summary": "A7.1 declares the permissions manifest exhaustive and fail-on-extra, but the bound manifest lacks lifecycle-deletion and disposition permissions and schema-migration principal, action, and provider permissions while A8 and A10.3 mandate destructive disposition and forward-only migration execution. Required operations are therefore either denied or cannot be authorized by a complete tested oracle.",
      "evidence": [
        {
          "path": "intent/0001/EXAM.md",
          "sha256": "91f2744d0675f3c62eb122b2783e3aee147c85981740d0f3f4409b53808e6b10"
        },
        {
          "path": "intent/0001/reviews/domain/remediation/PERMISSIONS-MANIFEST.candidate.json",
          "sha256": "46a483533cb1153b0391a9463ca6c3848862ed3bf43b9c7e861077860175bf73"
        },
        {
          "path": "intent/0001/reviews/domain/remediation/RETENTION-AND-RECORDS-POLICY.candidate.md",
          "sha256": "271d4fa1ee2682f06e504e615cc9e8588ea34ff3ff7d5e2c27f245f80509c96c"
        },
        {
          "path": "intent/0001/reviews/domain/remediation/validate-remediation.mjs",
          "sha256": "15197f339d9eed125885c806f66adff790d67e69247910236b84f9107a0d1044"
        }
      ],
      "requiredResolution": "Add explicit narrowly scoped permission actions, eligible principals, provider scopes, protected-path, retention, deletion, and migration selectors, and denial, race, and retry tests. Update every affected hash and obtain a new exact-revision review."
    }
  ],
  "escalations": [
    {
      "triggerId": "unresolved-blocker-or-major-finding",
      "reason": "IRREV-G2-R2-001 is an unresolved major authorization-oracle gap: the Exam mandates irreversible lifecycle disposition and forward-only migration operations that the exhaustive bound permissions manifest does not explicitly authorize or test. A qualified human irreversible-operations specialist must evaluate the gap unless a revised exact target closes it; this agent cannot waive or accept it.",
      "findingIds": [
        "IRREV-G2-R2-001"
      ]
    },
    {
      "triggerId": "irreversible-external-effect-or-material-rights-impact",
      "reason": "Lifecycle deletion or disposition and destructive schema migration can create irreversible external effects or material rights impacts. Any such execution requires separately verified eligible-human authorization under a complete, narrowly scoped, tested permission oracle; this review record does not authorize execution.",
      "findingIds": [
        "IRREV-G2-R2-001"
      ]
    }
  ],
  "boundaries": {
    "doesNotSignGateTwo": true,
    "doesNotAuthorizeBuildOrRelease": true,
    "doesNotAuthorizeProductionOrSpend": true,
    "doesNotAcceptResidualRiskOrWaiveControls": true
  }
}
